{
  "protocol_version": "media-capability.v1",
  "request_id": "019f8a10-0000-7000-8000-000000000001",
  "task_id": "019f8a10-0000-7000-8000-000000000100",
  "status": "succeeded",
  "result": {
    "stage": "planning",
    "status": "running",
    "reason": null,
    "recovering": false
  },
  "evidence": [
    { "id": "019f8a10-0000-7000-8000-000000000200", "kind": "task" }
  ],
  "next_actions": [],
  "error": null
}
